cn,vi
藕白梨黄橘红茶绿鲫鱼鲜鲤鱼鲤鱼鲜嫩鸭子肥壮鸡子肥壮。,"Ngó trắng lê vàng, quất hồng trà lục;
Mè tươi chép lớn, gà béo vịt to."
德行合于无疆年龄超过九秩寿命称难老庆祝多次。,"Đức đến vô cùng vượt qua chín chục.
Thọ nay hiếm kẻ cầu chúc tam đa."
八岁的佳人喜欢说话九龄的才子试试明经。,"Tám tuổi giai nhân mừng giải ngữ.
Lên chín tài tử thử minh kinh."
一泓秋水余清之气满地春风散发异香。,"Nước thu một vùng thừa hơi mát;
Gió xuân đầy đất toả hương lành."
陈平等人归附登上觉岸自由信仰进入玄门。,"Bình đẳng quy y, đến bến giác;
Tự do tín ngưỡng, vào cửa huyền."
德泽救济百姓和尚怀着慈悲之心在永福殿台上颂颂永福殿拜望冬至夏末记载前功。,"Đức trạch giúp dân, thánh mẫu lòng từ ban phúc lộc;
Điện đài vọng bái, đồng qua hạ đến nhớ công lao."
梵宇巍峨万丈毫光悬挂日月禅门辉煌千秋香火对乾坤。,"Điện Phật nguy nga, vạn trượng hào quang ngang nhật nguyệt;
Cửa Thiền xán lạn, ngàn thu hương lửa sánh càn khôn."
英名传于古代传于三代封典于今永远征兆。,"Từ xưa danh tiếng truyền ba đài;
Đến nay phong điển vẫn còn hay."
学道于西天紫霞嶂千秋传授佛教安民南地李朝再世出现王身。,"Học đạo trời tây, Sài lĩnh ngàn năm truyền dấu Phật
Yên dân Nam Việt, Lý triều tái thế hiện thân Vua"
在花间的驿站步行寻觅芳香的情意海岸上听涛声激荡壮怀。,"Trong hoa cất bước, dấy ý tìm hoa;
Bờ biển nghe sóng, gợi lên tráng chí."
读书山有路勤于行径学海无涯苦于作舟。,"Núi sách có đường, chuyên cần đi tất;
Bể học vô bến, phải khổ làm thuyền."
我年少时曾经在一起游览曾经拔剑割天发誓消灭仇敌真正的谋略韬素蕴蕴大有父亲的风范。我夫子在席前谈论志向时常发动心意时危有谁来拯救？正想挥戈挽日失去英雄独怜忠孝两全留作我的同党鉴老将军海外闻哀之日莞然开颜。,"Nhớ khi tuổi trẻ cùng chơi, đã từngmang giáo chỉ trời cao, thề trừ giặc cướp, thật là đã gồm tài thao lược, theo lối của người cha, thầy học ta khi nói chỉ học trò, lòng đà khâm phục;
Gặp lúc nguy nan ai cứu, những muốn múa gươm xong cuộc thế, đã mất anh hùng, chỉ tức rằng trọn đạo hiếu trung, làm gương cho bạn hữu, lão tướng quân lúc được nghe ai tin, mặt vẫn tươi cười."
我眷爱你多年美德超生今日依仗你的慈爱。,"Ưu ái nhiều năm đầy ơn đức;
Siêu thoát hôm nay nhờ vẻ từ."
佛德弘扬凭借众慧祖的功德继承接应要当人。,"Phật đức mở mang, nhờ quần chúng;
Tổ đức thừa kế, dựa người nay."
美好谨慎闺房仪表南国山河资助内治清高庙宇仪表方民香火显示英灵。,"Thận trọng khuê nghĩ, sông núi nước Nam nhờ nội trị;
Thanh cao miếu mạo, khói hương dân nhớ hiển anh linh."
几点梅花迎接淑气几声鸟语报答春光。,"Mấy chấm hoa mai nghênh khí tốt;
Vài lời chim hót não xuân vui."
一个禁止在故园中心中常常想起来重重遮住千里的眼睛烟波江上不能忍受。,"Lòng lưu luyến vườn xưa, sợi chỉ trong tay thường vẫn nhớ;
Mặt khuất che ngàn dặm, trên sông khói sóng gợi thêm buồn."
过去人们认为有所作为的前面有所作为的后面君子的道德是儿子的是臣子的。,"Chỗ khó người xưa, có làm lúc trước, có làm lúc sau;
Theo đạo quân tử, để dạy cho con, để dạy cho tôi."
上老年老老人到了百姓就会兴起孝顺所以亲近父母天下就会太平。,"Trên đã kính già tất dân đều tốt;
Xưa yêu cha mẹ thì nước yên bình."
盛世开怀远行于神山寻找野外追寻明时寄托自己的感慨在圣明的地方得到幽深的情绪。,"Đời thịnh mở lòng, bước tới non thần tìm lạc thú;
Thời minh gửi ý, phóng nhìn đất thánh thỏa tâm tình."
赋宜家室春风早梦叶熊世泽长。,"Phú nên gia thất gió xuân sớm
Mộng lá hùng bi phúc trạch dài."
堂堂祭祀鼎俎酬谢先烈孝子仁人竭尽至诚。,"Từ đường đỉnh vạc cúng tiên tổ;
Con hiếu người nhân hết dạ thành."
德行在于百姓功业在于国家生存是良好的死亡是神灵的。,"Đức với dân này, công với nước;
Sống làm tướng giỏi, thác làm thần."
读古人书注重天经地义为后世效法不忘祖德宗功。,"Đọc sách người trước, nên nhớ đất ngang trời dọc;
Làm phép đời sau, không quên tổ đức tông công."
士大夫回答说：为什么呢朝廷选拔官员的恩德国家崇尚的意思世道的维护就是这样罢了礼乐衣冠所依赖的地方声名文物所集中的地方。,"Nói sĩ phu báo đáp là sao, nhờ ơn tuyển chọn của triều đình, nhờ ý quốc gia được sùng ái;
Gọi thế đạo duy trì là thế, cho lễ nhạc y quan đều tốt, cho tiếng thơm văn vật đều hay."
九天超越快乐飘着寒月一曲襟凌紫烟。,"Chín tầng thiều nhạc đưa trăng lạnh
Một khúc thanh tiêu vượt khói mây"
鸾凤和鸣昌盛百世麒麟祥瑞叶子庆贺千年。,"Loan phượng hót chung mừng trăm thuở
Kỳ lân điềm tốt chúc ngàn năm."
婺宿流辉光辉照耀水宫衣服艳丽跳舞园桥。,"Sao vụ sáng ngời soi nước biếc.
Cung y rực rỡ múa cầu ngân."
启教凭藉慈光集合灵文三宝藏永远承接救助圣德弘范妙手一扬枝。,"Giáo hóa dựa lòng từ, kết tập văn thiêng ba bảo tạng;
Kế thừa theo đức thánh, trừng vung tay khéo một cành dương."
福慧庄严普度众生都出尘慈悲喜喜舍弃龙行利以解除迷津。,"Phúc tuệ trang nghiêm, cứu giúp chúng sinh - đường giác ngộ;
Từ bi hỉ xả, luôn làm điều thiện - thoát mê tân."
春天的诗歌春天的画画春天的面孔都是醉了笔墨也是醉了心情也是醉了。,"Thơ xuân tranh xuân, mặt xuân đến;
Bút say tình say lòng cũng say."
芳名此日登天府花烛今夜映洞房。,"Tiếng thơm ngày ấy nêu thiên phủ.
Hoa đuốc đêm nay sáng động phòng."
饮酒荣美的佳肴分为三雅醉后歌狂惊动四座。,"Uống vào mùi vị chia ba loại;
Say rồi hát loạn hãi bốn bên."
政令靠德行成就一个人有喜事福气从上天降下来万寿无疆。,"Chính trị lấy đức thành người người vui vẻ;
Phúc lành theo trời giáng vạn thọ vô cùng."
青山不厌千杯酒白日可消一局棋。,"Núi xanh chẳng ngán ngàn chung rượu;
Ngày trọn vừa xong một cuộc cờ."
春风送暖归杨柳细雨飞红上碧桃。,"Gió xuân đưa ấm cho dương liễu;
Mưa nhẹ thêm hồng đến bích đào."
忠孝一心天地照耀敬诚二字鬼神知道。,"Trung hiếu một lòng trời đất tỏ;
Kính thành hai chữ quý thần hay."
破千重关心怀天下读万卷书志在四方。,"Phá ngàn trùng quan, nghĩ về thiên hạ;
Đọc vạn quyển sách, chí ở bốn phương."
用来教育别人的人教导自己在努力上勉励自己的心。,"Lấy điều dạy người dạy mình;
Ở trên lao lực lao tâm."
茶号无双酒称第一家。,"Trà vào loại tuyệt hảo;
Rượu đáng khen nhất đời."
移山不忘愚公的志向兴业必须保存赤子之心。,"Dời núi chẳng quên Ngu công chí;
Dấy nghiệp phải bền dân chúng tâm."
雅谈诗尚书执行礼仪更加友爱公允诚信多闻广闻。,"Lời nhã thi thư giữ lễ;
Bạn hay thẳng thắn nhiều nghe."
怒气中说：快后悔后悔可以忍耐。世间财富得难失去容易只有节俭勤劳。,"Nói lúc giận, phát ngôn vội vã, hối lại đã chầy, nên phải suy phải nhịn;
Của trên đời, kiếm được khí khẳn, mất đi càng dễ, chỉ có kiệm có cần."
桃李满庭花如锦芝兰广座客如云。,"Đào mận xum xuê hoa tựa gấm;
Chi lan tấp nập khách như mây."
柳眼桃腮舒化日莺歌燕语喧春风。,"Liễu như nhũ đào hồng ngày đổi khác;
Oanh ca yến hót báo xuân về."
万户管弦歌盛亡百般红紫绣芳春。,"Muôn hộ sáo dàn ca thịnh thế:
Trăm mầu hồng tía dệt xuân vui."
安南壮气雄壮山河在平北除去妖灵草木知道。,"Tráng khí An Nam sông núi đó;
Dư linh bình Bắc cỏ cây hay."
积善堂前无限乐长春花下有余香。,"Vui vô hạn, trong nhà tích thiện;
Hương có thừa, hoa nở mùa xuân."
台阶下的花开花开花光照耀堂中燕子来到燕子投入怀中。,"Dưới thềm hoa nở hoa ngời đuốc.
Trong nhà yến đến yến đang mong."
十二日返回成功由于利。壬申再造自于天机。,"Quý dậu hoàn thành do lợi đất,
Nhâm thân tái tạo tự máy trời"
金身现在的地方黑暗而明亮鼓声转动音律迷惑就会醒悟。,"Thân vàng biểu hiện mở mà sáng;
Tiếng trống ầm truyền tỉnh chẳng mê."
独自坐着只因为上天可以对着野外行走常常有月亮跟随着。,"Ngồi đọc chỉ mong trời đối mặt;
Chơi rong thường có ánh trăng theo."
千里月色显现过去了无限风光笔下生出来。,"Ánh trăng lắm vẻ soi nghiên mực;
Phong quang vô hạn bút khởi nguồn."
吉星高照平安宅福星常临积善家。,"Cửa bình an cát tinh chiếu rọi;
Nhà tích thiện phúc khí hay qua."
火光摇动红色的影子辉煌金屋衣袖带着芹香滋润在洞房。,"Chập chờn ánh đuốc chiếu nhà vàng.
Thoang thoảng hương cần nơi hợp cẩn."
允武允文功勋垂于竹帛圣明历经朝廷典章重壮方村。,"Dù võ dù văn từng trải công lao ghi trúc lụa;
Là thần là thánh các triều trọng vọng mạnh thôn dân."
遇到有升沉的时候都好像梦中一样与生死交往都是没有情感的。,"Gặp cảnh thăng trầm coi tựa mộng;
Vào nơi sống chết khó vô tình."
桂子登上龙楼夸耀拔萃兰孙引凤笑。,"Con quế cưỡi rồng khoe tài giỏi.
Cháu lan đưa phượng cười điểm trang."
群鸟长歌歌声顺耳众芳同喜喜寿增添。,"Chim bấy đồng ca, ca tai thuận.
Mọi hoa đều chúc, chúc thọ tăng."
景静楼清千姿万姿媚地灵草翠四辰春。,"Cảnh tĩnh lầu thanh muôn vẻ đẹp;
Đất thiêng cỏ biếc bốn mùa xuân."
一家喜庆三春暖两姓欢欣成百世缘。,"Một cửa đón mừng ba xuân ấm
Hai họ vui chúc trăm năm duyên."
波涛泛满台阁鱼戏浪太阳照耀琼楼燕啄泥。,"Nước soi gác về, cá giỡn sóng;
Trời chiếu lâu quỳnh, yến tha bùn."
事情大了早做必定早做子贤增加教育更加明白。,"Việc lớn sớm làm càng sớm đạt;
Con hiền thêm dạy sẽ thêm thông."
最爱惜百花可怜春露能够滋养万物就是春风。,"Trăm hoa khéo bón nhờ mưa nắng;
Muôn vật sinh sôi cậy gió xuân."
历朝封表西关镇旧有古熏高上等祠。,"Các triều phong tặng Tây quan trấn;
Từ xưa hương khói Thượng đẳng thần."
云阁教佳人灯烛交辉经籍藉明时培博议台阁亲近国士淑才双美绣香处有文章。,"Gác sách tiếp giai nhân, đèn đuốc dáng chưng, kinh sách gặp thời nên biết rộng.
Đài trang thân quốc sỹ, đức tài trọn vẹn, rèm thêu hương ngát tập văn chương."
柳暗花明好鸟枝头也是朋友山峰回转路转白云深处有人家。,"Cành liễu hoa tươi chim đẹp nhánh đầu như bạn;
Nẻo quanh non biếc nơi sâu thẳm thấy nhà ai."
画不能充饥可以作名士文章隐匿姓氏大有一个不正直的人。,"Họa không đủ no, không kể danh sĩ;
Văn mà dấu họ, tất có vấn đề."
追求学习将会成为自己的本领读书贵在于虚心。,"Cầu học cốt cho thực dụng;
Đọc sách quý ở hư tâm."
他的父母在家中有名的婚姻两人同济美堂中有龙凤并增辉。,"Danh hôn dưới gối hai đều đẹp.
Long phượng trong nhà rạng cả đôi."
雨催玉树终天恨云暗竹林两地悲。,"Mưa dồn ngọc thụ chung trời hận
Mây ám trúc lâm lưỡng đất bi."
神功深远莫测圣德沉默地扶持。,"Thần công khôn lường sâu;
Thánh đức phù trì kín."
云拥芦旗天开运包咸水马匹终归神灵。,"Mây cuốn cờ lau', trời mở vận;
Bao hàm ngựa nước, đất linh thiêng."
江山到处风云护护香橘连春雨雾调。,"Núi sông đến đó gió mây bọc;
Hương quất vào xuân mưa móc đều."
波心似镜子留下明月松韵如竹林吹动午风。,"Lòng sông gương sáng trăng còn tỏ
Thông reo sáo thổi gió đang về"
生意就像春天的意思财源就像水源一样。,"Buôn bán như xuân ý;
Tài nguyên tựa nước nguồn."
从前的学问商量更加深邃新的学问更加深刻。,"Học cũ xem ra đều sâu kín;
Mới hay bồi dưỡng sẽ thâm trầm."
上天要保佑他好像在德行德行要盛于高高又难以称名。,"Trời phù hộ hẳn hoan như có mặt;
Đức cao đầy với vời khó nêu tên."
长观皓月静读天书。,"Ngắm nhìn trăng sáng;
Lặng đọc sách trời."
水底何年留显迹于秋台自古以来仰慕余威。,"Đáy nước năm nào, lưu hiển tích;
Đài thu tự cổ, ngưỡng uy thừa."
慈祥之间留下香气培养人才表现女子的美德在故乡留下遗迹勤劳王室显示臣子的忠诚。,"Phòng mẹ thơm hương, nuôi dạy nhân tài nêu liệt nữ;
Làng quê dấu tích, siêng năng việc nước tỏ trung thần."
依然水枕风船重重地向着烟波寻找旧梦何必一定要淡妆浓抹一片空色相见天真。,"Như xưa gối nước thuyền trôi lại hướng sóng mù tìm mộng cũ;
Hà tất thoa son đánh phấn, cứ để không mà được tự nhiên."
清思抱明月高怀对古松。,"Lòng trong trùm trăng sáng;
Nghĩ cao sánh tùng già."
豹的皮和虎的皮虎的皮千狐的腋膀五羊的皮。,"Báo đổi văn đốm, hổ tổ chất đẹp;
Nghìn cáo để lông, năm dê để da."
一条溪水粘天其余的胜地半山拥立后面独有高台。,"Nước vít trời cao thừa thắng địa;
Núi ôm đất thấp biệt cao đài."
九天日月开新运万国笙歌醉太平。,"Nhật nguyệt chín tầng khai vận mới;
Vạn quốc sênh ca túy thái bình."
月下彩娥来跨在凤凰云间仙客近乘龙。,"Người đẹp dưới trăng vui với phượng
Tiên khách đường mây thoả cưỡi rồng."
一江红日高低路两岸风远近图。,"Đường cao thấp ven sông che mặt trời mới mọc;
Gió thổi mát đôi bờ như tranh vẽ gần xa."
堂北萱花荣九秩天南宝婺耀千秋。,"Nhà bắc hoa huyên vinh chín chục.
Trời nam Bảo vụ sáng ngàn năm."
他饱览古今事情淡泊了解南北之情。,"Xem nhiều việc xưa nay;
Biết ít chuyện nam bắc."
沿着台阶的花木树木都显得奇观一座亭子春天的景色近水的楼台多有妖幻的景色满院的兰花风吹拂。,"Bên thềm rực rỡ cỏ hoa, một đình xuân sắc;
Gần sông tháp thoáng lâu đài, đầy viện gié thanh."
东风吹进屋内喜气满门。,"Gió đông vào nhà
Khí lành đầy cửa."
广海仰神麻安澜沾圣德。,"Biển rộng nhớ ơn thần;
Sóng yên nhuần đức thánh."
万里江山新景色三神骨肉欢喜团团。,"Muôn dặm non sông vừa đổi mới;
Ba kỳ ruột thịt lại chung vui."
历朝保护国运千年史越句镇守神灵万古神灵。,"Triều triều rạng rõ ngàn năm sử;
Hồn Việt hun thiêng vạn thuở thần."
鸳鸯对舞回转月光鸾凤同鸣叶纳春。,"Uyên ương múa cặp thu vầng nguyệt.
Loan phượng cùng kêu đón gió xuân."
古寺没有灯火明月照耀山门不锁白云封锁。,"Chùa cổ không đèn, trăng sáng chiếu;
Cửa non chẳng khoá, trắng mây che."
他巧妙地运用神机安抚妙手开辟鬼谷出现乌金。,"Khéo khiến máy thần, hiến tay giỏi;
Mở mang hang quỷ, lấy vàng đen."
奎星天空明朗人文灿烂碧水春深道脉长。,"Sao khuê, trời sáng, nhân văn tỏ;
Nước biếc, xuân sâu, đạo mạch dài."
道是人师现在施行权力开启善化降下佛种应当来兴建显远传灯。,"Đạo lý làm thầy, dẫn dụ quyền hành khai thiện hóa;
Nối đời Phật tử, sau này hưng hiển mãi truyền đăng."
景是神仙心是佛金为世界玉为台。,"Cảnh ấy thần tiên, tâm ấy phật;
Vàng đầy thế giới, ngọc đầy đài."
田野春光真好农家岁月更新。,"Đồng ruộng xuân tươi vui thực;
Nhà nông năm tháng mới hơn."
岩石的灵迹生成了将领变化成了神仙德年奉祀燕水长流外有祠内有寺庙千古尊严。,"Đỉnh núi dấu thiêng, sinh làm tướng, hoá làm thần, muôn năm thờ cúng;
Suối yến chảy mãi, ngoài có đền, trong có chùa, ngàn thuở tôn nghiêm."
树色溪光变得清净欣赏花香鸟语挽住尘缘。,"Sắc cây ánh suối nên thanh tịnh;
Hoa thơm chim hót kết duyên trần."
怎么能完全符合人意只求无愧于我的心。,"Đâu dễ làm vừa ý người;
Chỉ cần không thẹn lòng ta."
保卫越过山河云彩追逐北方扶持陈朝庙社太阳升东方。,"Giữ Việt non sông, mây đuổi Bắc;
Phù Trần xá tắc, mặt trời Đông."
先祖培养历代流传仁义是根本子孙兴旺延长寿命希望德行成为根本。,"Tiên tổ vun trồng, nối đời truyền lại nhân là gốc;
Cháu con hưng vượng, hàng năm nhớ mãi đức làm nên."
祖印重光如慧日香炉续焰如祥云。,"Dấu tổ trùng quang, theo ngày sáng;
Lò hương tiếp đượm, báo mây lành."
普照名兰原自古以来文辞和谐景色日益重新。,"Vốn cổ danh lam, làng Phổ Chiếu;
Sửa sang thắng cảnh, xã Văn Hoá."
流水行云谈论贝叶清风明月忆昙花。,"Nước chẩy mây trôi đàm lá quý
Gió lành trăng sáng tưởng hoa mờ."
神女月宫出生显现出美丽的迹象传说：葛母仪表天下就扬威配鹤峰高。,"Thần nữ cung trăng sinh hiển tích, dáng đẹp truyền nơi Vân Cát;
Mẫu nghi thiên hạ thật uy linh, sánh cùng chim hạc non cao."
变化而生出正气天上下神还在灵巫的地方北南。,"Hoá như sinh chính khí khắp trời trên dưới;
Thần như tại tiếng linh vang cả Bắc Nam."
生为将死为神正气留行于天地并功在史册英名赫赫古今都闻名。,"Sinh làm tướng, tử làm thần, chính khí lưu hành ngang trời đất;
Công tại Trần, danh tại sử, tiếng tăm lừng lẫy suốt xưa nay."
彩烛双辉欢合清歌一曲咏宜家。,"Vui hợp cẩn hai lần đuốc sáng
Vịnh nghi gia một khúc ca thanh."
蛟断长江事往万年保存地志鱼依恋五井春来三月拂西风。,"Chém giao long ở sông dài, việc đã ức năm còn chép đó;
Cá vào tiếng ngọc, tháng ba xuân đến gió tây về."
锦瑟声中鸾对语玉梅花际凤双飞。,"Đàn sắt tiếng trong loan đổi giọng
Hoa mai vẻ ngọc phương đôi bay."
乐奏云歌唱百岁德辉彤史祝千秋。,"Nhạc tấu vân ngao, mừng trăm tuổi
Đức ghi đồng sử, chúc ngàn năm."
国家长久山河巩固天道无边日月长。,"Quốc gia bền mãi non sông vững,
Thiên đạo vô biên ngày tháng dài;"
澄波影里天上的云彩飘动夹岸花间的蝴蝶飞。,"Sóng lặng bóng lay, trời mây động;
Bờ yên hoa nở, bướm chim bay."
客人来了难道是空谈四壁围书聊且当酒春来无别事一廊风月欲催诗。,"Khách đến há chuyện suông, bốn vách sách tranh cẩn có rượu;
Xuân về không việc khác, một vườn trăng gió giục làm thơ."
流水就是这样文武官员王侯的宅第高山长仰止三关深数分宫墙。,"Nước chảy vẫn như thường, văn võ y quan vương hầu phủ đệ;
Núi cao trông mãi thế, tam quan sâu thẳm mây nhận học đường."
香味辛辣到老年才知道桂树茂盛经过秋天才知道松树。,"Thông tươi tốt qua thu mới biết;
Quế cay nồng lên lão càng cay."
太阳照耀光明金殿阁月亮照耀光宅玉楼台。,"Trời chiếu sáng ngời điện gác vàng;
Trăng soi thiền viện lâu đài ngọc."
池上的绿荷挥动着彩笔天边的明月画出新眉。,"Sen biếc trên cao thêm hứng bút.
Bên trời trăng sáng đọng hàng mi."
香留德树花生颜色雪花花萼灵山石发出光芒。,"Cây đức hương thơm hoa sắc thắm;
Núi thiêng tuyết ánh đá sinh quang."
同德同心家道兴盛相亲相爱情深意长。,"Đồng đức, đồng tâm, đạo nhà thịnh;
Tương thân tương ái, tình nghĩa dài."
晚上读茶经能止渴早晨临米帖可以充饥。,"Tối đọc trà kinh dỡ cơn khát;
Sáng bên bồ gạo dễ bụng no."
四季和气春天常在一室安居乐业有余。,"Bốn mùa hoà khí xuân thường đến;
Một cửa yên vui phúc có thừa."
礼乐威仪恭敬如神在歌鼓舞乐在人和谐。,"Lễ nhạc uy nghi, kính như thần tại;
Hát ca cổ vũ, vui ở nhân hòa"
花间酒气春风远村里棋声夜雨寒。,"Trong hoa hơi rượu theo xuân đến;
Đầu xóm hội cờ tiếng mưa đêm."
呜呼许大山河征王不作赵安归翻教历史数千年多渠一死咄咄世界沱海水涨羞耻屏风山凝怨忍看胡须眉毛几百人与贼寇一同生存。,"Nước non rộng rãi đáng than thay! Trưng Vương không dậy, Triệu Ẩu về đâu? khiến cho lịch sử vài nghìn năm, thêm người chết nữa;
Thế giới lung tung đáng sợ thật! Đà Hải thẹn đầy, Bình Sơn thối ứ, nỡ để râu mày mấy trăm kẻ, cùng giặc sống sao?"
旧殿湖山留旺气新祠香火接余灵。,"Hồ núi đó xưa lưu vượng khí;
Tân từ hương hoả tiếp dấu thiêng."
五叶流芳遍大千一花显瑞遍沙界。,"Năm đời lưu truyền để lại tiếng thơm phủ khắp đại thiên thế giới
Một đóa hoa hiện điềm lạnh tỏa khắp pháp giới"
人欢马鸣升平世燕语莺歌锦绣春。,"Người vui ngựa hí, cảnh thái bình;
Yến hót oanh ca, xuân gấm vóc."
心落水木秀发幽深的鱼鸟栖息。,"Tâm an, nước cấy đẹp
Hứng nhã, chim cá nhàn"
阿弥陀息三途苦陀佛剪除十恶缘。,"A Di khiến tất tam đồ khổ;
Đà Phật giải trừ thập ác duyên."
水只有善于下能成为大海山不争高自极天。,"Nước khéo xuông thấp nên thành biển;
Núi chẳng tranh cao tự sát trời."
上苑的梅花开花九十岁高堂的桃树成熟一年有三千。,"Vườn thượng uyển mai mừng xuân chín chục;
Nhà tổ tiên đào chín tuổi ba ngàn."
不必百事一定要如意且喜欢六时长见书。,"Chưa mong trăm việc đều như ý;
Những mừng sáu khắc sách hay xem."
绿水自然形成壑谷春风无日不到山家。,"Nước biếc tự nhiên nên khe lũng;
Gió xuân ngày đến mỗi nhà sàn."
三代金身子育军生膏法雨历朝记载母仪千古翠英风。,"Thân vàng ba thế, nuôi dưỡng quân sinh xem pháp vũ;
Áo cõi mấy triều, mẫu nghi thiên cớ nổi anh phong."
几百年的旧家无不是积德第一等好事还是读书。,"Thế gia mấy trăm năm, không ngoài tích đức;
Việc tốt loại số một, vẫn là đọc sách."
解释前生诸传的债集合群众百姓保证平安。,"Cởi bỏ mọi món nợ truyền kiếp;
Giữ gìn cho trăm họ bình an."
政治通达世世泰泰千门强盛国富民强四海春。,"Chính thông đời tốt nghìn nhà sáng;
Nước mạnh dân giàu bốn biển xuân."
前寿五十天又迎接花甲等待延长十岁再祝祷古代稀少。,"Đã thọ năm tuần lại thêm hoa giáp.
Đợi tròn chục nữa, sẽ chúc cổ hi."
雄王宝剑凿田耕艺圣贤传播业绩尊崇农业。,"Vua Hùng mở nghề dạy cày cấy;
Thánh hiền ban nghiệp trọng nghề nông."
石头上的月光留下变化的痕迹瓶中的影子连着的影子散发出余香。,"Trên đá trăng soi lưu dấu tích
Trong bình sen bóng tản hương thừa."
七形成心自赤万言书写在汗犀青。,"Thất trảm sơ thành tâm tự xích;
Vạn ngôn thư tại hãn do thanh."
为人民服务一腔热血替百姓治理财政两袖清风。,"Phục vụ nhân dân một tấm lòng nhiệt huyết;
Để dân quân chúng hai tay áo thanh phong."
梵字巍峨悬挂日月禅门灿烂对着乾坤。,"Cảnh Phật nguy nga treo nhật nguyệt;
Cửa Thiền xán lạn đối càn khôn."
阳春的瑞兆和祥瑞飞出鹦鹉太吕律和引凤凰。,"Mây trùm dương xuân anh vũ bay.
Luật theo thái lữ phượng hoàng lại."
还没有出地的时候先有符节到了凌云的地方也没有心。,"Khí tiết rồi khi chưa lên khỏi đất;
Cao tận mây lòng vẫn thẳng ngay."
和气盈门迎瑞气春光满眼映文光。,"Hoà khí đầy nhà đón khí lành;
Xuân quang vui mắt ánh văn quang."
